review_id,user_id,business_id,stars,useful,funny,cool,text,date
bbq_zggtQ6x-pI0ogPjfCQ,p7ic5gPx3XCZGjPOb6fZkA,CwL56LgcMz7Bvi4xODHVSw,2,0,0,0,"I was drawn into the restaurant by how packed it was, which to me meant hey it must be good. Boy was I wrong. Service is mediocre and food is right there with it. 

Our server kept disappearing, we were lucky to get her attention, which would only happen if she happened to pass by attending other tables. 

I had the Atlantic Salmon and substituted my rice for extra vegetables. The salmon looked and tasted sub par and my vegetables were all boiled unseasoned carrots and maybe one or two pieces of asparagus. My uncle had the Fettuccini Alfredo, that was a giant portion, definitely promoting obesity. 

Overall, would not recommend. There's tons of places nearby I wish I had tried instead.",2016-06-12 03:33:21
T2NwRNqzU8WdztAFgkTbFg,PDVKrKkpVJuooVYWHFCuGg,CwL56LgcMz7Bvi4xODHVSw,2,0,0,0,"A beautiful place decorated nicely and in a perfect place in the hustle and bustle of SB. We stopped in and decided to have a snack and a drink in the bar area. It wasn't very busy inside, besides our group of 6, and there were a few tables outside.

We ordered our drinks (they do have a couple of good beers on tap) and waited. And waited. Did I mention we waited? We finally walked up to the bar and asked for our drinks, which were finally brought to us by some other worker besides our server. 

We got our food, which I will say the fries were really tasty. My friend ordered a medium well burger and it came out after asking for it again (which it really seemed like they just forgot to put it in at all). It was rare. So rare that it was mooing and leaving a bloodied plate. So gross. So we had to send it back for another. And we waited. Waited. Waited some more. We finally told them to cancel it because we were done waiting. 

Everything would have been fine if someone could have communicated with us, admitted an error, offered us a beer while we wait. Somehow acknowledged that they were really off on their game. But they didn't. 

When we were ready to pay, we had to track someone down; mind you we were sitting 5 feet from the cash register. Everything was a chore for the customer here, it was no a pleasant experience. I could also see a table outside complaining as well, so we weren't alone. 

Unfortunately I wouldn't recommend this place until the service changes. It wasn't busy enough to use that as the excuse so I will say that it must be the employees.",2014-04-20 17:34:28
53xvQpvwzJ6e8Yo0u1sfkg,XU1zDFALg52PDo1T0azHYQ,CwL56LgcMz7Bvi4xODHVSw,1,0,0,0,"I had a decent glass of wine but terrible service.  Maybe it was being a single woman of a certain age, but I had to ask a waiter for a glass of water (got it), no one asked if I wanted something to eat, and I had to ask a second waiter for my check.  I have never failed to tip but this time I did.",2013-07-14 17:39:41
UgRe9S68hqDYT0iO6MUUjg,N1M3fzlWg4ppdJIywj_2_g,CwL56LgcMz7Bvi4xODHVSw,2,0,0,0,They have poor customer service. We ordered drinks and they forgot to bring one persons and acted as if they didn't take the order. We had like four different waiters. The food was good but service was poor,2013-05-30 18:04:11
A1wFjjs6CTsg6iATaun7Tg,dFgr7P9jii6b4hk-cgL1HQ,CwL56LgcMz7Bvi4xODHVSw,1,0,0,0,"This place is noisey, the minute you walk in you're repelled by some of the worst irish music you've ever heard. The food is mediocre, nothing you couldnt mqke yourself for half the price, and the service is aweful. Really hope La Arcada steps up its game or throws in the towel.",2016-03-19 02:41:10
RSiSuVWhYQzH3doniU4Vtw,zeCg5mCcTGIbOHYo-xC2FQ,Kg71HUigI1rnY3UMFiLx0w,3,1,0,0,"I love supporting independent, creative cafes like this. And my kids love empanadas. The staff were very friendly and the boutique in the back is adorable.  We ordered one beef and one chicken empanada. They were already made and the nice young man said that he would have to heat them up. Overall, our experience was nice, but I have to say that we did wait over 30 minutes for the empanadas. That's too long for empanadas. Other tables were saying the same thing so they need to address this. It's too cute not to make it!

We will go back though and give them another try.",2017-09-11 13:34:05
r7xitwa0mJoc9asin0B7BQ,aimmWxPlAvTEXHx5ocNB6g,CwL56LgcMz7Bvi4xODHVSw,1,1,0,0,Sign out front: $5 cocktails during happy hour (12-3 pm) great! It's 2! And there highlighted cocktail of the day is a Bloody Mary. Good drink even though not super loaded like other places. But low and behold they charge us $10 per drink and refuse to lower the price. OK. Not coming back here.,2014-07-16 21:22:56
0aSI5doVNbj2sq9t1lxXwg,c5lDTYtS-g_euDt3nWcfQA,CwL56LgcMz7Bvi4xODHVSw,1,0,0,0,"Came in on a Saturday evening to an almost empty restaurant with plenty of wait staff working to order a drink and two appetizers. Drinks ended up not coming until I asked about them 25 minutes later and only one appetizer was delivered. We cancelled the other before they delivered it (it had been over 35 minutes). The fruit and cheese tray that was delivered cost $20 and consisted of cheese slices (think Kraft cheese from the super market) and Philadelphia cream cheese. Based on the tables around us, these issues did not seem limited to us. Common problems were other tables not being waited on, food being very late, and drinks not refilled. I would steer clear of this place as there are plenty of other great restaurants on State street.",2016-02-14 02:32:42
eSrHeTEUe0yT5d0fnz5UEg,3n31s0aH-Btf4vp2pOootA,CwL56LgcMz7Bvi4xODHVSw,3,0,0,0,"The waitress was real nice however she had disappeared before we received our food. Apparently she went on break. We all of a sudden had a new waiter. Which was fine but I wish they would have told us about the change. 

The food was good. The ""new"" replacement waiter we had was friendly. This place is also dog friendly which was great.",2014-05-28 18:10:28
z_Mnc0tN7Fvgs1FcDlI2lw,KVYJN6dR6NBo8FoPpJVN6w,CwL56LgcMz7Bvi4xODHVSw,2,0,0,0,"The Happy Hour was ok. the ambiance is nice, but the service was AWFUL.  I literally had to ask 3 times for water and no one came by to check on us.  I would have gladly ordered more drinks, because the Margaritas looked good, but there was no way I wanted to wait for another 45 minutes to be acknowledged, order and then have it brought out.",2013-06-02 22:17:28
y241ccwSdMC2KWsEdNiyog,HgAu2uGgYFejUpipiNrP2Q,CwL56LgcMz7Bvi4xODHVSw,2,0,0,0,Average food. Definitely not worth what you pay. Also really stingy and inflexible. Advertised special pricing for happy hour beers and ending up getting charged full-price.,2015-08-09 03:31:46
IkPtSUm8LLRWfrO31fcodQ,tEaM1ztkCR2YvE4zNz_gTA,CwL56LgcMz7Bvi4xODHVSw,2,3,0,0,"Had Sunday brunch here recently, chiefly because the place was empty and there was a line outside Andersen's, where we meant to go. Throughout our meal, the (small) restaurant was never more than maybe 40% full, and I counted 4-5 servers on staff. Nonetheless, we repeatedly had to go out of our way to track down a server to place orders or get coffee refills. We actually wound up placing a follow-up order with the busser.

The food was okay; nothing to write home about. The coffee was crappy, and the waitress wouldn't even fill the (small) mugs most of the way. Service was generally gruff, slow, and not terribly competent. The waitress actually dissuaded me from ordering a side, telling me that the item I wanted was part of the dish, even though it wasn't mentioned on the menu. Of course, when the food arrived, the item was nowhere to be seen, and our waitress didn't make another appearance for a half hour or so.

This place is within a block of at least three or four restaurants that will serve you better food, faster, for the same or less money.",2013-11-18 01:04:03
M0l1yQ3T18mPJwP5KISgAA,qzgjMo0AaSDIxOpoAJCmKg,CwL56LgcMz7Bvi4xODHVSw,1,1,0,0,"This place is disgusting! I've been to many many restaurants and consider myself a foodie at heart, but never in my life have I've ever been to a place as horrible as this. The service is bad and the owner is a complete bitch. They messed up our order and instead of apologizing she blamed us. Something that has never happened to me. The place is dirty, to expensive for the shity food they serve, and their one restroom is worst then a portable one. Don't waste your money!",2016-08-06 21:50:56
ZJqUMS1ejOcUF8Fp2UnFyQ,U7W_1v2wHq8DK76CI2mCZg,CwL56LgcMz7Bvi4xODHVSw,3,0,0,0,La Arcada Bistro offers relatively standard lunch fare and a nice outdoor seating option.  They do give you a large amount of food - although the turkey club sandwich was a bit on the dry side.  But thank you for the avocados - they can go in any entree.,2012-10-17 19:20:57
MQNJGVLpQHONEowiH435Pg,dCzuosNz4lK5qVsEI5Z0zQ,CwL56LgcMz7Bvi4xODHVSw,2,0,0,0,"Food was so-so. My wife and I had the specials for the new year - was not that special. Location is good and staff was friendly, as far as the food goes I will probably not come back here again.",2014-01-02 00:17:32
G8A4m50u7iTuXXMV2Maiwg,D5DXS5MYE0DfgrR9Q-RBsg,CwL56LgcMz7Bvi4xODHVSw,3,1,0,0,"The best thing about this place is the owner and his daughter are nice people. However the food is just okay and the price is quite high. We were visiting Santa Barbara and found this cute little place. Our server was the owners daughter whom we found to be very friendly. We went back the following morning neither the owner or his daughter were there and the service was terrible! Also we paid $12-$13 for a sausage and eggs breakfast that was no better than Denny's! There were more servers than customers, by two to one at least and the service was slow and unattentive. It's like they were all hiding in the back. When the cats away the mice will play! This place has the potential to be a 5 star establishment if the owner can get the Chef and the servers on the same page.",2014-01-23 04:09:53
8qFs5w3aBUMPGBtpttLLKw,8sqeOvPyAg1400e8ghkMnQ,CwL56LgcMz7Bvi4xODHVSw,2,0,0,0,"Okay, I know an Irish themed place can be crazy busy on St. Patrick's Day, but this was ridiculous. We knew we would have a wait, but, not for the hostess to acknowledge we were there. She was chatting with customers. When she saw us, she said she'll be with us in a minute. Try 20. We flagged down a young man who apologized, found us a seat and then told us it was his first day. Another 20 minutes goes by. No waitress. No water. No menu. We flagged down the same young man who got a waitress to serve us.  As we left, the hostess told us it was her first day. If you're going to hire staff because you know it's going to be busy - TRAIN them. My daughter and I have both been a hostess and a waitress. This could have been handled better.",2017-03-19 16:27:20
S-YHAcrcgfuNu3DlwsHF2g,qE6H6eBkGF0CFKzv0uCC9A,CwL56LgcMz7Bvi4xODHVSw,1,0,0,0,"Look here's the thing, the atmosphere and location are ideal but I think I had better service ordering a hot dog at Costco. I even would hazard to say that I had better service at a street cart in Istanbul (true story). Their ticket time for a party of 3 was 45 minutes, and this is for breakfast. My coffee came in under 5 minutes, but my friends took some where around 15! We had two different people waiting on us that each told us something different when asked where our food was. I even asked the manager and she wasn't sure where it was. 45 minutes later three plates of what can only be described as being some what better than the ""breakfast"" you got at a holiday Inn; actually I take that back because I have had decent luck eating at motels. Now maybe we caught them on an off-day or maybe it's just lack of caring, but for $16 dollar eggs there are far better options in Santa Barbara.",2014-11-19 09:40:12
5CceSkxHrMPE2ShNRx6lHg,wOJHB_uUB2rOjpx58Au6PQ,CwL56LgcMz7Bvi4xODHVSw,2,0,0,0,"I popped in here for a quick lunch. I sat outside, as it was a beautiful day.
The service was quick, but distracted & impersonal. I ordered a half sandwich with a cup of soup. The lentil soup with spinach was pretty good. The half sandwich, BLTA, was appalling. The lettuce and bread (supposed to be toasted bread) were both limp, there was one slice of bacon sort of draped over the lettuce, the tomato was unevenly sliced and the ""sauce"" was indescribable...it was supposed to be simply mayonnaise. 
A total waste of time and money.",2014-05-31 00:39:42
TeFMf5I9Xiu7vpqdpb6SKw,0pnNw1rqdvmNq8IcyHpKpw,CwL56LgcMz7Bvi4xODHVSw,2,2,0,1,"I've had a rule of thumb to not say anything bad about a place unless I've been there at least a couple of times since everyone has a bad day now and then.  Being a local to Santa Barbara, we know how high the restaurant standards are and, unfortunately, the future doesn't look bright for La Arcada Bistro.  I'll cut to the chase to save you reading time.  Tried it twice and both times a huge food disappointment which is truly too bad since it has great curb appeal.  The place could be a huge hit if they could simply get the kitchen and wait staff in order.  It could be because they have a tremendous location, curb appeal and get by on tourist traffic but I sense they would slip quickly if they had to rely on local support.  We're truly hoping the owner gets thing in order because we'd love to see it succeed but, unless we hear of some changes, I think we gave it our last chance.  There are simply way too many really good restaurants in the immediate area.",2012-09-15 23:47:19
4kak5Y_2Tj9HURuANCEvJg,Mg9mEuK7oSk6a6kCaAtRig,CwL56LgcMz7Bvi4xODHVSw,1,0,0,0,Server was incredibly rude and come to find out she was the owner! Food was ok nothing special and still pricey. My friends and I will never go back. There are a lot better restaurants in SB to go too.,2014-09-12 20:59:17
DQWFPYaB27_b1GM8rbdnUg,f515Si5yfmENRFZuRQ4Q5A,CwL56LgcMz7Bvi4xODHVSw,1,0,0,0,"We visited La Arcada Bistro on Saturday night. The owner sat us and was very friendly. It took a few minutes to bring our water, but then it got ridiculous. We sat, waiting for about 20 minutes for the waiter to take our order. He never showed up, so we left. We went across the street to Aldo Italian Restaurant, where we were promptly greeted, attended to, and served.",2013-05-17 13:51:05
njJNUg_2O4hpsg4QL0Qd-Q,cPQOKQjpEED3sQfuvIpumQ,CwL56LgcMz7Bvi4xODHVSw,2,0,0,0,"Went here for Sunday Brunch and was very disappointed. I ordered the Santa Barbara Eggs Benedict and it was extremely bland. The english muffin was cold and the hollandaise sauce was sparse and flavorless. Even the side of potatoes were under salted. Also it was a very warm day and there was either no AC or they made a bad decision and didn't have it  turned on; so we all basically just sat and fanned ourselves with our menus and sweated. I'm giving this place 2 stars instead of 1 because I tried a bite of the seafood pasta and it was definitely not as bland as the eggs benedict but still nothing special. So I would say, if in Santa Barbara, try this place at your own risk but I would probably recommend going somewhere else.",2013-05-14 01:52:37
E_5Pnu_LzIbn1EbL3iup4A,gkTNxOkNE3QnXbT-FvjeJw,CwL56LgcMz7Bvi4xODHVSw,2,0,0,0,"I wish I could rate food and service separately. The food was decent but the service was less than attentive. I think they have a ""team"" approach that doesn't really work for anyone. Avoid the French dip sandwich. Meat was thick and fatty but the flavors were good.  I wouldn't go back.",2014-09-15 15:10:29
RZAHlAjjLM32sP_ogyXq-g,s9fQJuGfpQ4gtmuHfB-TRA,CwL56LgcMz7Bvi4xODHVSw,1,0,0,0,"I rarely actually take the time to write full Yelp reviews. Only the exceptional places tend to make it. That being said, I feel very strongly in submitting my experience in this case. My friend and I had a really bad happy hour in Santa Barbara which is quite difficult to pull off. The raspberry mojito that was recommended tasted like it was from a bad soda can. I've never sent a drink back until today. The waitress/bartender said it was fresh which was an absolute lie. There was hardly any mint and no actual berries in the drink. My friend didn't care for her Bloody Mary either. The whole atmosphere was off and the service was lacking considering we were the only ones there. Certainly not going back.",2015-11-21 01:14:25
lB2TufKjOsCUCP6tL6drww,Zw5dxMhihnFI7X7l9yW3nQ,CwL56LgcMz7Bvi4xODHVSw,1,0,0,0,"I would NOT dine here again. One of the specials was tomato basil soup, and I ordered a cup, to go along with the toasted tuna sandwich. I got a bowl of vegetable black eyed pea soup with curry. I questioned it, was told yes, this was the tomato soup. Then I questioned it again, and was told that there actually was no tomato basil soup today. Odd, very odd. The sandwich I split with my daughter, however, was fabulous.",2015-05-17 19:56:02
ImRCZNPU1uWD38-TD-6rfw,25-ambB-trVHaTpuA3kdQQ,CwL56LgcMz7Bvi4xODHVSw,3,0,0,0,Great location for people watching. Mediocre food. The steak bites appetizer on their dinner menu is pretty good.,2014-03-21 19:11:53
3j3eeEv0ovvlS9FgMRrDbQ,R_30u8PnUFT31pJDQv8BNw,CwL56LgcMz7Bvi4xODHVSw,2,0,0,0,"Horrible service. We sat down for 10-15 minutes before the waitress came by. Once she took out order we never saw her again. Somebody else brought the food to us, and we had to grab another waitress to give us our check. Would not recommend.",2012-08-20 17:52:20
TOO2UwtM7mCMeZa-nJQMWg,MQq36a4_7X4Drb5rG6P6UA,CwL56LgcMz7Bvi4xODHVSw,1,1,0,0,Good ambience. Worst and pricy food...waste of money. Will never go back,2012-10-22 05:39:51
MI9PMg9fCHdjVuHh6Dz6Zw,jslYZp5xhX5_aNZ7OcRM7A,CwL56LgcMz7Bvi4xODHVSw,3,0,0,0,"Ordered a hot grilled chicken sandwich. The chicken was precooked and was cold.  Asked to re make it and they did. 
Other sandwich was a turkey and was totally below average. 
Service was average.",2016-03-19 22:27:09
BK5ZHfSPzDXS-d2wLmYqSg,Ent20aeW_eew20oN2jjafg,CwL56LgcMz7Bvi4xODHVSw,2,1,0,0,Had dinner here last night. I ordered the salmon with basil sauce and vegetables that the waitress recommended. The service was slow even though it was not crowded when I got there.  The food was bland. I had to add a lot of salt and pepper to make it work. I got a few pieces of heavily oiled carrots and couples slices of tomatoes for vegetables. The cost of the meal $35.00 (that included a glass of wine). I think it wasn't worth it. I won't be dinning there again.,2016-02-14 19:50:29
T8O-jpA5cYnrOCyUtOzxQg,UlSdtyLmtGtls8iZD8lmuw,CwL56LgcMz7Bvi4xODHVSw,1,2,0,0,"Do not eat here!!!!! The food was so so, but then again I was hungry. It took the waitress about 20min. to come and take our drink order. The girls in the table next us were complaining as well. Our food was meh... To say the least. They never came to check on us or offer us refills . My aunt asked for an extra plate twice and was never brought one. So many places to eat in state st. , its really a mystery how a place with such terrible service stays open.",2013-04-21 07:13:58
cr_UrPxa6bGt34_cQcwvyg,9EyFlqhv1zEOWTPCFOj8qg,Kg71HUigI1rnY3UMFiLx0w,1,0,0,0,Now I wish I could do half a star because that customer wasn't me... please make sure you know which customers you don't like before making a situation worse. I was there to eat not cut things in half. I believe your attitude just now proves my point,2018-07-01 10:50:34
ye8ZHMIQHcjkto-mjWB6yw,za-mhBnShYZ7FDhuE1k0Ew,CwL56LgcMz7Bvi4xODHVSw,2,0,0,1,"Was excited to try this place. Came here for brunch and sad to say we were disappointed.  
The good points: coffee was really good. Service was a little slow but nice and friendly. The steak and eggs were good. And the bacon was tasty it was the best part of my meal. 
The bad points: the la arcada breakfast special was so disappointing. $12 for 2 sad pieces (1 piece of bread) of soggy French toast, eggs and bacon. Don't waste your money on it. The crab cakes Benedict was awful. It tastes like it was canned crab. Very fishy and unpleasant.",2014-07-20 19:56:34
iOc9UyXt5zN_4QTPoFoNwA,UpXQj_kVM7t9mbyzwyRVcg,CwL56LgcMz7Bvi4xODHVSw,2,0,0,0,"Don't be drawn in by their lovely, shaded patio. The food is really bad and pricey. Staff was nice, but spread too thin. Cleanliness is questionable. There are so many great places to eat in SB. Don't waste your money here. Go next door to Andersen's.",2016-10-18 19:53:52
BHFWjF7_Z7FUiFI9PL3uXw,5yolNU8aaVh6Zu-gRbfIRQ,CwL56LgcMz7Bvi4xODHVSw,2,0,0,0,"The setting is gorgeous! But man, not impressive on the food or service. Stopped here late afternoon not long ago and it took forever just to get one round of drinks. Finally had to wave down a server (who then nicely hurried over to help us). 

The white beach bellini was tasty, but the club sandwich was meh at best. Nothing special or even tasty about it. Boo. The tomato soup was over seasoned and disappointing. 

Great French music though, and when I first sat down, really felt like I was in France for a bit there.",2013-07-28 03:34:54
FzJ-AOfpf7HcGpEaVPg-Hw,_xgYdQyseIyaIoeRsQFm5A,CwL56LgcMz7Bvi4xODHVSw,3,0,0,0,My husband and I were exploring State st and we walked by this place and decided to go in and have a couple of drinks. The owner and his wife were very welcoming and enjoyed talking with them as well. We ordered Guinness on draft which was great and also had a couple other drinks as well. Also had live Irish music which was nice.,2015-05-21 01:39:38
kFmC-slWK5pDdMMgEtr8Gg,EWFZp3TZkmsCP8mcX-8OtA,CwL56LgcMz7Bvi4xODHVSw,2,0,0,0,"Perfect location but TERRIBLE service and food. 

The good: Location and menu items looked very good. Also mimosa special for brunch

The bad: Waiters seemed to avoid tables and had to flag someone down for everything we needed. Took 30 mins to get 1 of 2 coffees and a mimosa we ordered. Ordered within 10 mins of sitting down and got our food an hour later (party of 3 straight off the menu, restaurant was half full maybe) Food was just bad. Good choices but eggs were undercooked, sausage was at least an hour old and cold, soggy toast, canned hollandaise and too little. Better food at Dennys and WAY cheaper.

We talked to the ""manager"" who couldn't explain what was on our bill, or after us telling her what we had ordered, put it onto a correct bill. We gave up and paid. Never going back. Poor management, terrible service and food was uneatable. Really wanted to like it due to location and menu :/",2014-11-19 07:18:34
zlLIIamL6muviNK41uTD-g,iJMlAYDVLSDwQsmEsZjPOg,CwL56LgcMz7Bvi4xODHVSw,3,0,0,0,"We wondered into the La Arcada Bistro because they're located next to the cute side street.
The street off the State Street had a little fountain, flags and etc. displayed, and we chose their outside table.
 
I ordered my usual savory eggs, and V ordered his usual sweet waffles. They were both fine; our plates were served warm and timely.
We did enjoy our dining experience outside facing the cute side street, but our plates were simply average.

By browsing Yelp reviews, it appears that there're plenty of brunch options along the State Street to choose from in addition to La Arcada Bistro; we plan to take our time to choose our next ones.",2016-06-30 14:49:05
BokaTDOtUaX_xkYe0Jf84Q,sjQH2MPv_tKMNJj9FUQGaA,CwL56LgcMz7Bvi4xODHVSw,3,0,0,0,I enjoyed the chairs. Daquiri was watered down. Ceviche was tiny and the amount was cheated with salad.,2014-07-11 23:49:49
xiLRrcTR13w06lnBBj_cnw,9EyFlqhv1zEOWTPCFOj8qg,Kg71HUigI1rnY3UMFiLx0w,1,1,1,0,"Terrible service the minute we walked in. She said she was closing and the food had to be to go, but it was 4:16pm not 4 or 4:30, she had the lights on, tables set up and music on. I was going to leave but my daughter wanted one so I ordered. She got my order wrong and then only wanted cash. After paying her she was rude when I mentioned she didn't provide with one of the empanadas and instead of trying at all to fix the situation she raised her voice and got upset with me and I ended up leaving without the rest of my order because she admitted she messed up but then wanted to charge me more for the next empanada when the price written down was less. It was the lady with the blonde hair and turquoise contacts that got defensive and rude from the start. The man that works there is so friendly and she completely ruined the experience. 
From the moment we walked in she made us feel unwelcome. Rude rude lady.",2017-11-28 01:13:42
Fi3tD9AhIlNTskVpbwU9Hg,il9bSLqKYdwBcMY6VoM_lQ,CwL56LgcMz7Bvi4xODHVSw,3,0,0,0,"The phrase I would choose for our lunch here is ""barely adequate"". I had a blue cheese burger that was serviceable but uninspiring, and my wife's vegetarian sandwich had a nice filling but stale bread. The service was passable but - as another review mentioned - somewhat impersonal. In sum: we paid $40 for two entrees and two drinks and felt that we hadn't really gotten our money's worth.",2014-09-01 23:09:44
4Rxanvrp35w8ja1LGwf4kw,rTyn3YHLhXyIJwRfqeRxEg,CwL56LgcMz7Bvi4xODHVSw,3,1,1,1,"We didn't order food as we had eaten beforehand.  We had some green tea and my sister and her husband shared carafes of vino.

If it is your thing, it's definitely ours, do consider checking out the live music.  Great Irish tunes, and american ""ballads"" and some country too.  A fun night, we went on a Friday, but there might be music on Saturday's too.  I'm sure there is more info on the internet.  Cheers.

To my understanding they don't serve breakfast everyday.",2015-01-25 22:38:27
