review_id,user_id,business_id,stars,useful,funny,cool,text,date
Ly39CMxD1dOu4M3--pbtRQ,MNR3PupMJNisug3iKoGK1g,Hj44PIrCtv61ETVclzLMwg,2,3,1,2,"At the time we visited this location, they were all out of the Lobster Rolls that our party of 10 wanted to get. So everyone ended up ordering salads...eeeww....SO I was not impressed with this location nor the food that we had to order! I suggest not visiting this location or at least ask if they have the food you want BEFORE you go in and sit down!",2020-06-12 20:55:21
JlfjTNAd-bYXiU-KVNkrJg,SPqHksAvn3PDHQV-X8_pog,Hj44PIrCtv61ETVclzLMwg,1,2,0,1,Please offer a selection of $1.50-2.50 muffins for the AM rush...not just high-priced unhealthy pastries/cookies (Andersen's Danish Bakery already has that market cornered...no muffins there either.),2011-12-29 08:23:22
I36LaWpuSOlV2_lk9OEW-g,-TqgbDujKd9RoeFlu-p-aQ,Hj44PIrCtv61ETVclzLMwg,2,0,0,0,"I chose Jeannine's because it had a good crowd and, from the outside, its atmosphere was fun. Viewing the menu beforehand, I also saw several healthful vegetarian options -- always a plus for me.

It's not nearly as enticing once you get through the door. The decor is awfully outdated, the tables wobble, and the furniture is not-so-tastefully mismatched.

We spent 5 minutes in line before deciding that for-here patrons were supposed to find a seat before ordering. We spent another 2 minutes at the table before realizing we were wrong and got back into line -- at the end. The cashier/register asked me to tip before ordering, which was smart because I forked over a lot more than I would have otherwise. 

My Huevos Rancheros ($13?) were poorly prepared, with gritty beans, overdone eggs, and rough tortillas. My wife's biscuit was dry and her request for no tomatoes on her scramble was ignored ($11?). After picking at our food for 20 minutes, we walked to a cafe next door to fill up on pastries. 

The staff was pleasant enough and the service was quick (once we figured out the flow), otherwise Jeannine's would get 1 star.",2015-08-17 17:18:56
wlNyUp3JXSO3-GMRht6J0Q,egoihRmAdV7lMqcsO7ov4Q,Hj44PIrCtv61ETVclzLMwg,2,1,0,0,"I was excited about trying this place during a quick weekend getaway from LA.  I'd heard it's one of the best brunch places in SB and there always seems to be a line when I walk by.  Sadly, I was disappointed by the quality of the food.  Maybe I've been spoiled by the brunches in LA, but I found the ingredients to be less than fresh, and the flavors unoriginal, if not a little off.  I ordered the crab omelette, and it immediately smelled fishy as the server approached the table with the dish.  This tells me the crab is not fresh.  They also paired it with a heavy pesto sauce, and shredded cheese, which is not melted at all.  This was a miss: a creamy dill or any sort of cream sauce would've cut the fishy flavor and complemented the crab.  But the pesto was just a weird match.  Even the biscuit was stale and tasteless (and I love biscuits).  I will say that my almond latte was delicious, and the fat free wheat free blueberry muffin was alright, given it's ""healthy"" labeling.  Ambience was nice, and there actually was no line when we went at 9am on a Saturday.",2017-05-21 17:47:35
QHWWxxK3FY3xiZTEVJcbfA,FFTamgbke3qnn5XnkE1Qnw,Hj44PIrCtv61ETVclzLMwg,2,0,0,0,"I love the idea of Jeannine's. Open early, delicious chai lattes, and a delicious 'sounding' menu. My experience this morning sorta blew though. I ordered the 2 egg breakfast with potatoes. I wanted to substitute tomatoes or fruit perhaps instead of the bread. The answer was 'no.' Not what I'd wanted to hear, which would have been 'absolutely,' OR 'ok, that will be a $1 more.'  Whatever, I got over it. Then my husband ordered the California Omelet, which 'sounds' amazing with fresh avocado and fresh tomatoes and cheese. When it showed up, the avo was hard as a rock and the tomatoes WAY less that ripe. Seriously...you KNOW that that will make the omelet suck, right?? When he mentioned it to them, all they said was, 'ok, thanks.'  Looks like we will find another spot for uber-early brekkie...",2013-04-05 18:27:49
S4OaDDpY_7-YzPvl1cjLCg,VsK_MiiYu9qlHaZ6PTjFoA,Hj44PIrCtv61ETVclzLMwg,2,0,0,0,"Excited to try this place after the reviews and recommendation.  We arrived before noon and got a lovely table outside. Asked for water and told to help ourselves with papercups.  Then we see people being provided glasses of water by a waiter.  We get the fact that we had to order our own food, but it was a bit nebulous about how to get silverware, napkins and glasses?  The quality of food we received was fine however they seem to have a problem with whoever orders the food and ensures the bakery is well stocked.  There were very limited bakery items left and absolutely none in the main case.  The attendant said it had been a busy morning.  After we sat at our table, a gentleman came out and apologized but the soup we had ordered was finished (before noon).  Said they did not expect so many people to order soup. Asked about the bakery items and he said he had tried to order more that morning but without luck.  Very disappointing to go to a bakery that is out of bakery items before noon.  So whoever manages Jeannine's needs to get better organized.  We won't be back in a hurry.",2019-07-27 14:01:31
lUW5A6Fydk5ykhRgk8gUUQ,wslpBzgOpJdCyFyql3tDzw,Hj44PIrCtv61ETVclzLMwg,3,0,0,0,"I used to come here almost every weekend and it was amazing- good service, good food. However, the last several times I went the service has definitely gone downhill. I have noticed the usual manager, Lalo, was not there the last few times and I think that's why. The staff gets orders wrong, the kitchen does not send the order out together, and the staff acts like they are doing you a favor if you ask for something. For my family of 4 I easily spend $50-60 for breakfast and expect better service.",2018-05-06 18:04:36
LZ0D7jdlYOoHsiMXzXWKUA,VEDzb6Kqf7xMwTIHeyFb7Q,Hj44PIrCtv61ETVclzLMwg,1,0,0,0,"Great food! Always come here for breakfast. Until management decided to inject a little chaos. Now, there are so many people that you must get in line, then after 20 minutes they refuse you to place an order since you don't yet have a table. You  must find a table which means you lose your place in line, go out and stand around other people eating and as soon as they get up you must grab their chair among other people grabbing the same chair. Then somehow go back in line while holding the table. Want to complain? The girl that supervises this chaos  is on hand to tell you ""next time find somewhere else to go""  Really?",2018-09-22 23:32:27
8dTmwgEB-FYrl1T8XB2RiQ,NkE-ORKVsdVAtwOGuBsbsw,Hj44PIrCtv61ETVclzLMwg,3,1,1,0,"This is not a cheap eatery. We ordered a chicken sandwich, a roasted beet arugula salad with a side of spinach lentil soup, and an iced tea, and our bill was over $30?! Don't get me wrong, the food was good, the place is really cool, but the service was ok. You help yourself, just like many restaurants are doing these days, where you order your food, get your own silverware and condiments, seat yourself and your food is brought to you. But those two times are just about the only two times we interacted with staff. If you want something, you have to either get up and get it yourself or go to the counter and ask for it.

We sat outside on the mall side. But we should have eaten breakfast here, not lunch. We just missed it by a half hour. But they don't serve breakfast all day. Maybe another time:(",2014-04-19 08:26:40
bJdvbSx_C0BzGWcnWCk6Eg,jnKRO3Tu9eJWtJEk6gyc6A,Hj44PIrCtv61ETVclzLMwg,2,0,0,0,"I do not understand how Jeannine's receives such great reviews.  We went there today based on these reviews.  The Eggs Benedict ($16) were not good at all.  The English Muffins were like rubber, eggs were almost hard and very small, hollandaise was very sparse. the potatoes had too much salt and it was difficult to get coffee refills on the patio whereas inside there was someone going around refilling.  All in all it was not a good breakfast for the price.  We will not be returning.",2018-12-12 22:11:25
t669CIWdAqjhQwDTc1q3MA,HD98XTml4iKCCP6M7NxfRA,Hj44PIrCtv61ETVclzLMwg,1,0,0,0,"Passed up three coffee shops that were full of people before settling for this place, which was almost completely empty. No wonder! The staff was rude and the iced tea cost $3.78. For that price, I expect it to be served with a smile. What a contrast to the Montecito location, which I eat at on a weekly basis. What a disappointment.",2014-02-16 23:17:22
HF-C87f2uHD3uxximx-r8A,cbv2eA5U1img-m5P9QegfQ,Hj44PIrCtv61ETVclzLMwg,3,7,3,4,"The Quick: The servers were incredible! Food was good, average but good. You pay at the counter, get a number, and they bring to the table. The best part was the beautiful block is located in. There aren't many options so wasn't a bad option. Overpriced for what it was but not extravagantly priced",2018-04-13 21:27:04
zEO7pbgyr_xMXKXIWKNeQA,ENm-kPLqGvbYIe3PcMSQ9g,Hj44PIrCtv61ETVclzLMwg,3,0,0,1,"The ambiance is nice and has a European feel to it but the service is completely absent. Maybe coming here on a busy Father's Day weekend didn't help matters but we allotted an hour and a half to eat lunch before heading to an appointment next door - and this was cutting it very very close. No one is there to greet you or tell you what to expect. So the customer looks around and sees a line of confused people and stands behind that line. Do we seat ourselves? Are the people who are standing ordering to go? The customer is expected to stand in line and order at the counter and then a tip is expected on top of that. A tip for what? Waiting in line? Being the good customer I am, I tipped 20% anyway, (who knows where that goes or who it goes to). The food was good but the hot tea was cold. Because there's no service, forget about asking for refills or silverware. Or anything for that matter. Anyway, I wish there was a little more sophistication with the staff, this place has the potential, for sure. It's in a great location. Perhaps all the confusion could be resolved with a sign that says, ""Order in line and we will bring the food to you."" They would then earn another star for clear communication.",2019-06-16 23:12:47
ew1qxgoyCeQ-o3XW57xBUQ,G9PjrCToVOukgpxEpxsVlg,Hj44PIrCtv61ETVclzLMwg,1,0,0,0,Appalled that a Black family was accosted by a racist patron this weekend and told not to sit near because they were not that far from slavery.  More appalling that patrons and staff overheard this action and did nothing.  Clearly need fir Jeannine's staff to have training as to how to respond to welcome all.,2019-01-09 19:08:11
C2d2BoguMeksqAZ-CaTedA,PQi6mewkOeYc8SvrkwJBQw,Hj44PIrCtv61ETVclzLMwg,3,0,1,0,"Everything looked so good and a group of friends even say they're the best. Unfortunately I craved for egg Benedict, so disappointed that the egg yolks were not running.",2019-01-21 05:56:05
s_VYUtPRwVN4zw71VzTmMw,M5ogUSt6EQlydapbaVo6Ug,Hj44PIrCtv61ETVclzLMwg,2,6,1,0,"I lived in Santa Barbara for a decade, and I avoided this place at all costs. The seating/ordering process is a frustrating and convoluted waste of time. Every time I had a visiting friend who wanted to eat here, I tried to steer them away. Aside from the ridiculous marathon that is ordering and securing a table, the food itself is way too expensive for what it is and the staff doesn't care one teensy little bit if you're satisfied with your meal or experience.

Example? On my most recent visit, I ordered the huevos rancheros without the salsa (since I can't eat tomatoes). When the dish arrived with tomatoes, I (very politely) told the server that I'd asked for it without salsa. He said ""it's just diced tomatoes, not salsa"" and then vanished, never to be seen from again.

I tried to ask someone else about fixing the ($15!) meal that I couldn't eat, but I got a couple shrugs and eventually gave up, since my friends were almost done eating and I didn't want to get back in that monster of a line just to re-order my food and delay everyone.

(P.S. The menu didn't list tomato as an ingredient in that dish; I double-checked. I had been given salsa.)",2019-09-25 02:10:46
8Z6N2Vi-LFSMh0U1h3wBzQ,5I6-yegWr4p1mtUMwNkVtg,Hj44PIrCtv61ETVclzLMwg,3,2,0,1,"This restaurant has good food but nothing that I would call super special.

I had the egg whites scramble with veggies and their gluten free carrot muffin, which was very tasty. My husband had the basic 2 egg breakfast with sausage and he also thought it was tasty.

Our bill which also included 3 drinks came to about $36 with tax and tip, which seemed a little high for breakfast.

We did enjoy our food but the ordering process was a bit disorganized. In a nutshell I'd say this place is alright, but I'd prefer to check out another joint next time I'm in Santa Barbara.",2013-08-23 01:46:33
Q61gzQmr2IJxTxrVhos6Zw,QyXb3cjNv_dSTBkew1FyGA,Hj44PIrCtv61ETVclzLMwg,2,1,0,0,"The hype is overkill. Honestly this place is nothing special. If you are visiting and decide to check out this place I would advise against it. It wasn't bad, just very average.",2019-04-13 17:59:23
9T_hs2LlHYU2XhvRhoqNfw,1Wwbe6G1yTiSgxctqgaTog,Hj44PIrCtv61ETVclzLMwg,2,0,0,0,"Giving them 2 stars for ambiance. The service and staff attitude did not match the rating we saw on Yelp, during our Santa Barbara trip. First, you need to order the food on the counter, Good luck if you are a family with kids and there is line. Second, you will be asked to pay gratuity during order, even before you are seated. This is not acceptable to me. How do I know what the actual service would look like? The minimum suggested gratuity is 15%. Third, you would need to go to the counter and get water yourself. So much for the service charge you pay upfront. Fourth, the coffee refills are included. But, the staff only brings you coffee. If you need milk or cream, you would need to get up again and get it yourself. Great!!! Hope, your breakfast still stays hot, by the time you return. Fifth, the attitude of servers was not friendly. You ask for Ketchup, the server may very well ask you to ask your server. Wait till your server returns. Sixth, the cashier charged extra for egg whites without notifying us. If you care about price, it was almost 33% extra for simple veggie scramble.

For the ambiance and price that this restaurant charges, I was expecting better service, convenience and friendliness from the staff. Had much better from restaurants, similar to this one.",2016-01-03 02:05:01
Ofnv8vNNeyW7LZiGJBGxcA,qVND8Pr4rdT5e5DIdJn9BA,Hj44PIrCtv61ETVclzLMwg,2,0,0,0,"This is an update to my previous response where I had given them 4 stars. I am sad to say that I used to love this place and I will not be going back unless I need an overpriced yummy cake. I usually order the chicken pesto on toasted ciabatta bread which comes with a side. I was never really a fan of pesto until I tried this sandwich out one day and so I kept going back. In the past year I feel that the quality of the food has gone down considerably. You know what has not gone down are the prices.They have increased.  $21 for a small sandwich, small salad and Arnold Palmer? The chicken used to be moist and tender and the past 3 times I have ordered it it is dry. They changed the bread to something that tasted like cinnamon today and I had to add a lot of sauces that I had at work to make it taste okay. I have taken coworkers on two separate occasions to Jeannine's and the first time did not impress and the second time the server forgot to bring bread and gave my coworker the wrong meal. It had already taken so long to serve that he ate it anyway but said he will also not return. For the price that you are paying I also think you shouldn't have to stand in a line and then hopefully find a place to sit. They have good breakfast and everyone is very nice but that is sadly where it ends for me. Perhaps try the one up upper State Street, maybe they have better food and quicker service.",2016-06-14 19:38:51
kP-yPQENKU-eNnUa-uZNAg,ZXNwO2bY3QTYP0k_5bhG1A,Hj44PIrCtv61ETVclzLMwg,3,9,5,8,"When the wife and I discovered our hotel didn't do a full breakfast, we went to Jeannine's three mornings in a row. The hotel staff had recommended it, the Yelp reviews were predominantly positive, and it was a short walk away. I came here with high expectations.

Jeannine's was certainly a nice (if a bit too cutesy) place but I wasn't wow-ed: 
-- Being a bakery, I was hoping for some fantastic scones (an old weakness). But Jeannine's had only very basic flavors (e.g. plain, blueberry, lemon) and the selection was the same every single day. I have come to expect more creativity than this. (local fruit? interesting combos?) But no. Yawn. I couldn't find one that appealed to me.
-- Many of their signature dishes rely on a slathering of hollandaise sauce, but I've just never been a fan (I'm a mutant, I know).  Plus it feels like cheating.
-- Prices are high here, yet food must be ordered at the counter (aka via a line). Seems like such a high-falutin' spot could afford some actual waitstaff.

That said, it wasn't terrible. My standard, two-egg breakfast used high-quality ingredients and was cooked just right. The setting was attractive, the coffee was good and the staff were reasonably friendly.  

The only food downside was the huevos rancheros special, which was super-boring and bland. (I switched back to the 2 egg breakfast on my third visit.)

Rating is tough. Between 3 and 4 stars for me, but since Jeannine's enjoys a golden reputation and a solid 4-star rating on Yelp, I'm feeling like they are overrated. 3 stars it is.",2018-11-03 02:23:32
lcw4IsaXLopf-ITO1QFrsQ,ONWRHzvI8jdSGVBqsWsuzQ,Hj44PIrCtv61ETVclzLMwg,2,1,0,0,"The location itself is excellent. The service was a nice, however the food was mediocre. I ordered the huevos rancheros...thumbs down!! Tasteless..very bland! Nothing like authentic huevos rancheros..maybe huevos rancheros gringo style. Husband had the biscuits and gravy and those were pretty tasty. Son had the American and it was just ok. Nothing to write home about.",2019-08-07 22:40:40
6tdQus2Z6mAEwdMOZZU4RQ,y5z1A4D9x9KoujqYcfOWmQ,Hj44PIrCtv61ETVclzLMwg,3,0,0,0,"Cute environment & patio, but I was rather disappointed in the food. The Lobster Benedict was underwhelming and the portion, along with potatoes and fruit, was extremely small for $23.",2019-09-08 21:50:19
o1-jDqWGp52elTyLbmvFOQ,iRr9q2QHuP1Fnp_oDV0UtA,Hj44PIrCtv61ETVclzLMwg,2,1,0,0,"I have been to Jeannine's many times and been satisfied. However, this morning I arrived at Jeannines at around 11:30. I am currently sitting at the table - 12:51 - and have not received any breakfast. It was quite upsetting to see table after table of people who ordered after me receiving their food before me. I am disappointed to say the least... and still hungry.",2020-01-01 20:52:34
J1n_UWV5j4l1O8qFaVk8OA,MqDgSw9wZFsaFFPRKh-k8A,Hj44PIrCtv61ETVclzLMwg,3,19,18,20,"We were in Santa Barbara on a three day birthday celebration, and Jeannine's was recommend to me for having great food as well as their brunch too. The place is pretty huge with outside huge patio also. This restaurant is clean and very open with high ceiling, there are three TV's with some old pictures. You walk in order your food pay for it grab a number then find a seat. I ordered the Banana Kahlua French Toast which was so delicious and so sweet with a few turkey sausages. The service was fast plus all of the staff was friendly and very attentive to our needs. There is a Peet's  coffee and tea shop located in the restaurant in the rear. The reason for 3 stars is because the unsex restroom was not as clean as the restaurant, and being for both female's & male's it should be check often.",2017-06-30 05:57:37
RnueMB610iV66_5keqeY0w,EuFufTXD_uoakveKqy1vhQ,Hj44PIrCtv61ETVclzLMwg,2,1,0,0,"Food is good, ambiance ok but terrible wait and a system of gaming guests that makes no sense.",2019-06-21 02:51:49
yY8O_as1eT6SNHdNC7MhxQ,nsTmZRhVzY5YahKZQkAPbw,Hj44PIrCtv61ETVclzLMwg,3,3,0,2,"Three-and-a-half stars. It was a rainy day when my aunt and I came in for breakfast on a busy Sunday. All the tables were taken, so they asked us to wait in line and order only when a table was ready. No problem, we waited less than 5 minutes. I ordered the yogurt and granola, my aunt had two fried eggs and potatoes. They serve Rishi tea and the jasmine tea is delicious. The tables are cozy and close inside, and our food arrived promptly. (Order at the counter, get a number and sit down). 

I've eaten here a few times and at other locations. Sometimes the food isn't consistent and I think it's a bit pricey for what it is so I rated accordingly. But, this location on E. Figueroa is great. Easy parking in a garage sort of behind the restaurant. 

I do like their house-made granola and strawberry yogurt ($11). It's A LOT of granola & calories. But delicious. My aunt had a big plate and I had to help her finish it. 

The bakery has lots of pastries, too, like scones, muffins and cookies.",2019-03-25 04:17:48
pxtqJHsBRSBOj01K2Q3Wlg,9p6DnnBNl1m8pWw66XTLYw,9uJuBPIQyrC0v9pVv3JKRQ,1,2,0,0,"We are vacationing from out of town. Our order was over $20 for two.  The coffee was luke warm and we were unable to drink it.  I ordered half sandwich and half pasta.   So disappointed.  I requested a little more sauce as the pasta looked dried.  We were advised that no additional sauce could be provided as it comes in pre portioned packages.  The pasta is just microwave packages.  If I wanted microwave, I could have purchased better from the grocery store and took it back to the hotel room.   This place is totally overpriced, and not worth the money.  Our first and last visit.",2014-05-08 06:03:45
vClHBcSpkcaYTHogzHkWYg,kn3PVmIqouuaqbG8oumu0Q,_6p_j0UL7ST3b2nvHw82eA,1,1,1,1,"The single star here I'm giving to the staff, they we're perfectly nice. My problem is that this cafe exemplifies a trend that makes me *livid*; businesses who adopt the minimalist/rustic/modern hippie aesthetic by using ""humble""materials and re-claimed wood, trendy branding and hiring some lightly tattooed staff. Yes, it all looks good. But it's utter BULLSHIT if the business doesn't actual care about the issues people who started these trends care about.
Maybe dial back the effort on ""branding and interior design"" and look into ""sustainability and climate change"". By the way, I'm not mad at super chic establishments who look gorgeous but  back it up with action. Cafe Gratitude is obnoxiously on-trend/good-looking/pricey - but they walk the walk.",2017-08-08 02:51:57
WV25Wrh9ihQ-7RaA1-DRvQ,Xzm3NMu5X-6BfV8LrvxINw,9uJuBPIQyrC0v9pVv3JKRQ,2,3,0,0,"First time trying this place with a friend. We both ordered their half sandwich and half soup or salad special. I raised the bar on that special because I wanted one of their ""premium"" panini sandwiches and a ""premium"" salad, so we paid what I thought was $2 more. Oh no, read the fine print, they also add $1 a sandwich and $1 a salad on top of the already ""premium"" $2 extra. WTF?  Why not just say its $4 more?  Oh wait, that wouldn't make it much of a ""special"" now would it (insert sarcasm to the fullest here.) 

Anyway, we got home and opened our ""premium"" feast and my chin just about hit the floor after seeing the boxes. The sandwich was like a quarter of a sandwich, not half...and the salad was like a handful of lettuce. I guess it would make a nice appetizer, except for the fact there was hardly anything on my ""premium"" panini. It was mostly toasted bread....I GOT TOAST. The salad, what little there was, was nothing special either. 

The irony is they gave me one of their cards to accumulate points. As in, I would be returning to do so. Sadly, that will not be the case.

As a side note, by other buddy told me he has eaten at other Panera Bread joints and the food was much better, and nothing like the SB location. I am not sure at this point I could be persuaded to try another Panera. We will see if time heals an empty stomach...or is that wounds? I am so hungry at this point I am not making sense.",2012-07-16 19:36:42
ZrT4pldJyiQQszWx2EjFEA,VXh5EWiN7zNakEP9yfPrsA,9uJuBPIQyrC0v9pVv3JKRQ,2,1,0,0,"Does panera understand that without a customer they have no business. The lines are huge, youre server for food walks aimlessly looking for you.  Need sugar free gluten free paleo options would make it super duper!",2017-08-16 15:28:16
NfFueTEqB267BA76CVq0Eg,8RVLG143w8Hpm-OuBIzNeA,_6p_j0UL7ST3b2nvHw82eA,1,6,0,0,"REBAR, WHAT IS GOING ON!!!!! 

You had the best cold brew in town!  I was willing to spend $4+ dollars every weekend morning after yoga.  The Iced Vanilla Lattes were amazing, and then the last two times it tastes nothing like vanilla or latte or even coffee.  I actually threw both away.  The first time I thought it was a fluke, but then it was exactly the same the next time. Let's fix whatever is happening, but until then, I guess I have to find a new place for my weekend coffee.",2016-05-08 17:59:51
vABIb5aoNG56NrTzyrOOtg,Sa9Jbde7d2kuzhVEAMRWEg,9uJuBPIQyrC0v9pVv3JKRQ,2,0,0,0,I've never been the biggest fan of Panera Bread.  One of my sales teams down the road desired the Panera so I decided to order 6 or 7 plates for lunch a few days ago from this particular Panera Bread.  One of my sales woman's orders was a chicken salad and it didn't even have chicken which should earn a 1 star rating.  The rest of the order was fine and I will try to collect a free salad next time around.  Also the parking lot for all the establishments in this area is horrendous during the lunch hour.  The Mac N Cheese was so good.. .and since I'm a lover of the MNC they've earned 2 stars at this point.,2012-12-05 16:26:45
