review_id,user_id,business_id,stars,useful,funny,cool,text,date
bi6GaeWDGceGv62lXTIKQA,RgtbLaiU22zqaCk20HgbiQ,bjhCtlYHrkgA5Ku8l-rB3g,1,1,0,0,"Very disappointed. We went to eat  at 2:15 on Saturday and were told the kitchen closed at 2. Their website says: Sat & Sun all day. Their website claims that they are open until 5.
I'm always a bit suspect of places that can't manage simple details like their hours on their website. It makes me wonder about the awareness to quality and other ""small"" items.",2015-01-04 02:26:46
dWotGplxOFvATs92qiAvuA,kRZYT3eiOg3C-wrPNgyMQw,O6RCCmz8-x4NhWJpI8KQug,3,2,1,0,"Food and coffee are great. Just have 30
Minutes to stand in line and wait for the ONE cashier to make change. Either they fix this and add another cashier or they will be dead. Shouldn't have to wait for one cashier while 5 other folks stand behind the one cashier watching the line grow. Adds other till!",2016-07-03 17:13:37
R0_ySza9avRlI2ktVMA5MA,iM7H0ZDpQsjtoT08eaGVrA,bjhCtlYHrkgA5Ku8l-rB3g,1,0,0,0,"I really wanted to be able to leave a good review, this place is within walking distance so the location is super convenient.  Basically, the food is mediocre, which is fine, I can handle so-so tasting food. It's the experience portion of dining here that caused such a low review. I saw the good and bad reviews, but I'm fair and like to judge from my own experience, so I came in with neutral expectations. I came in with a group of six people. We ordered separately, I was the first to order. However, our food took 25 minutes, and when we asked what the holdup was, no one seemed to know or care. We did end up letting them know the service was poor, and the guy I was explaining to walked away as I was speaking! He flat out did not care.  At this point, that's just plain rude. We tried to complain to the woman managing the floor and her response was, ""oh.""  Apparently, we weren't the only ones complaining, as we were walking out, another customer walked in to get her money back because her boyfriend has already been served and finished his food while she still hadn't gotten hers. This place has potential, but until they realize that service is an equally important part of the restaurant experience, they probably won't even try to improve. Such a bummer.",2014-10-12 19:23:18
lvenNxO98GCywBqGpoOVOg,xXpXyf7TLV_xvtDYk4kW8g,bjhCtlYHrkgA5Ku8l-rB3g,1,1,0,0,Terrible service.  I ordered take out and after 25 minutes I had to cancel my order.  I got my money back but what the hell?  It wasn't even busy.  I was watching them as the food came out of the kitchen and neither the kitchen staff nor the people serving had any idea what was going on.  Everyone looked clueless.  I suppose I shouldn't have been surprised that my food never appeared.,2014-10-11 18:38:34
ExrueIKXkzUI8y4R9L4pFA,8QAuY_XnWq9WbW0lYI7Vjg,O6RCCmz8-x4NhWJpI8KQug,1,9,7,3,"Oxymoronic name to begin with and I asked do you serve sparkling water with your Espresso and the lady said sometimes, clearly I didn't go in that sometimes! The cheap ass Quality Inn had free Breakfast that had more choices than this 'Breakfast' place :)

Espresso? Meh!

If you walk outside and look to the left you may find the breakfast place you are looking for :)

Kudos to the nice looking spot but it gives some sort of a fake vibe! Doesn't jive with a coffee shop, oh well.",2016-07-16 17:42:00
jcmv80VVNnzoX05kYaaB9A,OZ1NmK2RLv0UxGFABE0CHw,bjhCtlYHrkgA5Ku8l-rB3g,3,1,1,1,"Because we were already getting full from some of our other stops, and had more pastry eating to do, we didn't order much from here. My friend loves the little olive rolls. But for me, I chose a medium sized hunk of ciabatta. It was soft and squishy, just like I like it! My friend's kids split the chocolate brioche torpedo. For me, it was really dry and flavorless. It was the chocolate that made it palatable.",2017-01-03 20:30:16
kGdkH76Fpu2BFXSEea7qNw,JlXNjrNoqa0uQv3SWxy74Q,O6RCCmz8-x4NhWJpI8KQug,2,4,0,0,"Such an awesome vibe and location. Great place to chill. Unfortunately, the service is awful. The gal working at the point of sale (short bangs but long brown hair) could not have been more cold or uninviting. Wow. Horrible first impression. We took our biz elsewhere...",2017-08-08 23:17:23
huuMWl8WMOqMEdONeCXsnA,KoibCOucsZ0eluSGc11ehw,bjhCtlYHrkgA5Ku8l-rB3g,2,2,0,0,"I stopped in yesterday to ODB's new location after a procedure @ Cottage Hospital. I wasn't allowed to eat a day prior to procedure so I was hungry. Nurse told me ODB is now close by. Oh goodie! 
When I placed my order ~Cubano sandwich, with wheat&walnut, cranberry bread.....only that (my favorite) bread was not available. iI almost walked out. I should have.
It took  f o r e v e r   to get my  sandwich, it was 'eh, just not the same yummy taste,  salad was smaller and if I'm correct, it cost $2 more than at at old location!
So, I'll give ODB a 2 out of a 10. 10 being the best. Sorry guys, but you gotta step it up!
P.s. the lemon bar was so dry. ;( ick, I didn't eat it all. ;(",2013-05-09 18:27:16
ka6yiRaa0TnVIMni9pnM1A,pik-8Iakk4QGi4NhNE9kTQ,O6RCCmz8-x4NhWJpI8KQug,1,14,19,3,"Space and atmosphere-8 and then it's a downhill from there: Food-non existence, as in;
""So can I see your breakfast menu?"" ....""um, we don't have food here...just pastries, and oh, yes on Sunday we serve burritos"" -I SEE! The pastries stood there looking like more like fossils in a museum, far a part from each other, dry looking and utterly unappetizing. Void of course of prices, as if not expected to be purchased and eaten, no we are here as a metaphor, like the name of this place. The persons behind the counter are an odd bunch, the young girl is so oddly serious and aloof, for this kind of concept, while the bearded man seems like he just rolled out of his bed, and not a very comfortable one, if you know what I mean...the only one that fits the ""concept"" of ""eat cool, chill vibe, instead of messy food"" is the young dude, with the glasses, who might be the rich kid who's parents finance this.  Maybe they were secretly fans of the Breakfast Club (the ancient film) and settled on just the half part, not to give away their age.... I don't know, but this name is so very predictable to the essence of this place: cool on the outside, empty inside.

On a side not: photographs are terrific, and so is the idea of supporting those artists, but why not stay true to what you want to be? Either drop the name or bring on the breakfast, and it better be a damn good one!",2016-08-06 05:35:24
6KbcLsyAfAQhWrj_x4ScjQ,7TaVrRROCJRlYdC5orqmVw,bjhCtlYHrkgA5Ku8l-rB3g,2,0,0,0,Been wanting to try Our Daily Bread since it appeared on a nearby corner. Was disappointed with my first visit. Terrible place to sit on the corner of De la Vina and Alamar. The food was a bit overpriced and it took 25 minutes to get an omlet. There was no service. Cute orange chairs though and a good local brand.,2013-05-15 21:59:14
mAarXuPWGJRGHhi7iggHWw,XbGMpj4QtfU1ncrggrhRtQ,O6RCCmz8-x4NhWJpI8KQug,2,4,3,0,"Had a cappucino, that was pretty great. The coffeeshop was way too loud. They were blasting the music, made it hard to study and even have conversations. The staff seemed like they were messing around the whole time, and not really concerned with the customer.

Unsure if will come back. Just not a typical coffeeshop atmosphere. Staff seemed more concerned with having fun and playing really loud music than their customers.",2016-10-29 22:49:17
0q5jAmS5pA8RBFF7camV-A,9HzD54LamJ0hqtHkkRmyHg,bjhCtlYHrkgA5Ku8l-rB3g,1,0,0,0,"I actually can't comment on the food - I was so turned off by the place I left without ordering. When I went there today, I had to drive back and forth 3 times before I could find a parking space. When you get inside, there's a tiny sign on the cash register that tells you where there is a parking lot, but you still have to ask where it is. I wasn't even sure I could find anywhere for myself or the 2 people with me could sit - we managed to grab the last spot while we looked at menus - if we waited, it would have been gone and we would have been eating at the counter, I guess, since the staff wasn't even paying attention to how much seating there was and just kept taking orders.  I went to stand in line to order. While I was in line (next up to order) some people walked up and stood on the other side of the person ordering while I was standing there waiting - and the staff began taking their order, ignoring me. In short, no place to park your car or your butt and the staff seriously needs to pay attention. Won't be going back.",2016-01-18 19:11:08
XI6jtuTDemM0sHBUiSQU_w,P5T4eBDKKUiic9ZqRa_PJQ,bjhCtlYHrkgA5Ku8l-rB3g,3,1,0,0,"Breakfast was good. Offering gluten free bread is a plus. Not sure if Sustainable, Organic or Local. Probably not a cooperative or not sure how employee beneficial it is. No sign of accepting alternative currencies. The search continues. :)",2013-05-13 18:11:16
m30mxqq7Wg7JsFPfqmVJJg,tG05beg0YSxAbonS4GxuvQ,bjhCtlYHrkgA5Ku8l-rB3g,3,4,0,0,"Came here this morning bc it was close by, but was disappointed by the service.  The coffee was decent, the food was eh and again the lady working the counter was not very nice.  However hands down the bread here is legit.",2015-01-06 20:57:02
XKYaSeMMIxObKfJVEq4NWg,tPOnkiw7ifTTI-ojbV4MYA,bjhCtlYHrkgA5Ku8l-rB3g,2,1,0,0,"stopped by hoping to find a selection of breads of different grains and found the basics. The place was stuffy, employees looked war-weary and indifferent, the outside dining was BORING and the tables are cheap n ugly. Certainly not the experience I hoped for given that this was such a hip, happening place downtown. 
I must say that I didn't end up eating here -- nothing in the display cases looked of exceptional quality so I passed. I suppose the menu items might be good but I doubt I'll go back to find out. The place is just plain, old not inviting. Sorry ODB mgmnt/owner",2013-05-13 23:56:45
BiKyC-r9T4V0CO72b8yJDw,Ft4t7m1COMYKGHP3HF-A6Q,bjhCtlYHrkgA5Ku8l-rB3g,1,4,3,1,"We live in the neighborhood and were excited to be able to walk over for Sunday breakfast.  The restaurant was not busy, yet the tables were not bussed and were dirty.  We ordered and sat outside, and even the manager walked by without thinking to clean our dirty table, until we asked him over to do so (and to clean the one next to us so we didn't have to look at it too).

We ordered Spinach Eggs Benedict, yet were told that they were out of spinach.  They offered to substitute zucchini, which we accepted - yet had to look hard for when it came.  The hollandaise was more like a mayonnaise without any true flavor.  And while it was good that they didn't overcook the egg so the yolk would still be runny - they way undercooked it, with parts of the white still uncooked.  Yuck.

We were thinking to point that out to them, but there was a definite sense that no one who worked there would have even cared enough.

We also ordered huevos rancheros which was quite under-seasoned and bland. 

We bought a loaf of gluten-free bread to take home, and were seriously unimpressed - threw it away after eating less than half.

The inside atmosphere was fun, with the bright metal and orange colors, yet outdoor seating begs for more plants to hide and soften the boring and busy street corner the restaurant is on.

Come on Our Daily Bread!  Step it up and care!",2013-06-26 09:04:04
APeHGEkKBLli852unSbNuw,Y_gVr5WOMoTX6osc4rRJHg,bjhCtlYHrkgA5Ku8l-rB3g,2,0,0,0,"It was nice that they offered a veggie benedict and that they offered it on top of gluten free toast. However, when I think of benedict I think smothered in hollandaise and perfectly poached eggs. This place did neither. The eggs were overcooked so that the yolk was hard, the pesto hollandaise sauce was not impressive and they put only a small amount on top of each egg (it wasn't even enough to cover the egg). Maybe I just ordered that wrong thing, but I am not really inclined to go back.",2014-07-30 21:59:01
0qvnQCKhnK0inkGV5y127w,n3LHTzGc9395Fr0qIrsonQ,bjhCtlYHrkgA5Ku8l-rB3g,3,0,0,0,"Great bakery, wonderful food, but experienced rude, impatient service from the manager, even though I was the only customer. Maybe manager is just having a bad day. Hope this isn't the new norm.",2016-12-07 17:19:58
zRCTlhgWl72Q_fkQpzwAEQ,08zFwO7-FLmT4ZeRHB-i3A,bjhCtlYHrkgA5Ku8l-rB3g,1,1,0,0,"We live in the neighborhood and have been wanting to try out the breakfast here, as we can walk over and eat outside with our dog.The coffee was very good, but that was about it. Our breakfasts were extremely unremarkable--the french toast was thin and served with only a small amount of syrup, the scrambled eggs were blah as was the turkey bacon. And, they charge at least 30% more than other restaurants in town that serve better food.  We do not mind paying more, providing that the quality is there. ODB needs to check out their competition for value and quality. We will not be back. Not worth it! I really hate to give negative reviews, but they could do so much better.",2013-06-30 01:48:33
0eXXk9IOt13g0jKAW18xUg,YTnRKLV_dKj6cHaS0phoKA,bjhCtlYHrkgA5Ku8l-rB3g,1,0,0,0,"I don't usually review but I'm pretty hangry and after 45 minutes and $30 for 2 salads DO NOT EAT HERE! They were way overstaffed and my $15 salad was a pile of yellow romaine lettuce missing avo with bland dressing (and skimpy with other toppings) . With so many awesome options for salads and sandwiches in this town, save your money and go someplace else!",2017-06-11 20:23:31
gf2LhV53eTyf-3kMjN7HRw,dpCYf9StvHx6qb5MNuKCOA,O6RCCmz8-x4NhWJpI8KQug,1,3,0,0,Over price coffee really $3.50 for a 16oz. Cup what the heck. And their coffee is not that even that great. The Starbucks around the corner needs to get more parking spaces. That was the only reason I got coffee here since I couldn't find a parking spot.,2016-07-06 18:06:07
hCJL7eMJqCXzufvgANSjVA,GAfi14qJz9pcTUT7mtfQgw,O6RCCmz8-x4NhWJpI8KQug,3,3,0,0,"Perfectly adequate cafe to get a coffee and a snack. The shop itself it quite modern and open, with easy parking on the street or in the Paseo Nuevo garage. The coffee they were serving that day was smooth and enjoyable. They do not roast their own beans or make their own food, the food itself is ok and expensive, and there's nothing ""special"" about the location or service to make me choose Breakfast over Handlebar or French Press. I'd be more than happy to buy a coffee here if walking by, but there's no reason to go out of your way to come here when there are other better cafes in town that serve their own coffee and have better locations and service.",2017-08-20 17:02:25
ideb8knreV-4TsxS2-gk6Q,E5p6Zo3bgxLepIS0zUuERQ,bjhCtlYHrkgA5Ku8l-rB3g,2,0,0,0,"Super slow service. I went in before work to get a quick coffee. Took 10 minutes to get any kind of acknowledgment. Since there is no formal line. And they favor regulars, as soon as they walked in all their focus went to them started helping them out. In the middle of helping me out.I should have left. But this is the only coffee place between home and my office. When I finally reached the register, the girl was short, not very friendly and yawning.  I JUST WANTED A CUP OF COFFEE TO GO.  NEVER COMING BACK.  Just because of this. It's the small things that count.",2014-06-06 01:45:41
2Dez6z7PQzu0zOvjGgEXFQ,T-Py1aCS3uknSz9F8Sr8Fg,O6RCCmz8-x4NhWJpI8KQug,1,3,0,0,"I wish I could give negative stars because every ten times I've been here. HORRIBLE EXPERIENCE. I have to say I went to highschool with the girl at the counter. Always admired how pretty she was. Didn't realize the coldness that came out of her. I came here for a few coffees for my coworkers across the street they all had pretty serious requests so I asked the girl if she knew anything close or similar she literally just flat out said ""no"". Wasn't helpful at all then asked me to step aside so she could assist the person behind me. The person behind seemed to be her friend because her attitude went from like a wall to this cheery talkative thing. Then I had to stand there for about 5 minutes waiting for them to finish. Once I ordered she went back to being rude and lacking hospitality. Ive been in here multiple times. They make you feel like you aren't hip enough to come to their establishment. Which sucks because I've NEVER felt so shut out in a establishment. I've only wrote about 3 yelp reviews in my life but this one had to be done. I chose to remain anon because we have mutual friends. But something needs to change here. The staff, the bitter ass coffee that always tastes watered down, only thing good about it are the pastries. And they don't even make them. Drop your stigmas. Treat everyone with respect. This isn't the first or even the 10th REVIEW pointing out similar problems. Change or tank. Tell your gf she needs to work on her attitude at the counter at least while she's working. It's losing you business.",2017-09-25 15:23:19
vo4TzoRuWcVBepoJcINBDg,kp7rky4EBsHCRkFEO23f6Q,O6RCCmz8-x4NhWJpI8KQug,2,3,0,0,"Huge fan of Morgan work but disappointed about the place. I went to Santa Barbara a few weeks back and went to check the place. I really thought they will have more pictures around. Coffee is also very expensive! Could have been a great concept but not a huge fan of the layout. Get more photographers works and less merchandising (shirt, expensive boards...).",2016-06-27 17:42:37
8fyXNVozULs36eJr1KFtVw,JX-gw_h3WtfpuHoN0rEsTw,bjhCtlYHrkgA5Ku8l-rB3g,1,2,0,0,"Been twice. First time I got a hard loaf of bread. Second time I got undercooked wet French toast, but the bacon was alright. I won't be back.",2014-09-29 03:01:48
XD_dz--AyiyaFhY0WH-oUQ,PmhM4wxOvjvAOPfB7BD-Yg,O6RCCmz8-x4NhWJpI8KQug,2,5,2,0,"Someone had the audacity to open a place called Breakfast, and not even serve breakfast food. They have a couple scones and donuts, but I'm not sure if having those two items constitute enough to calling a whole coffee shop ""Breakfast"". It's not ironic enough to be funny, it's just annoying. The vegan doughnut dense and heavily sweet, but pretty good. ALSO they don't have a telephone number, which just adds to the annoyance of this place.  The expensive coffee, annoying name, and ""too cool"" vibe you get from this place outweighs the slightly above mediocre doughnut.",2016-07-18 19:24:21
bhHaM0Z2nTjeU7BIavQdgQ,j2Q4IcVcAPz0o4z04qMNgw,bjhCtlYHrkgA5Ku8l-rB3g,1,0,0,0,"I've visited this place three times now.  In a nutshell, the first time my friend threw out her pastry, the second time, our potatoes were burned, the third time (mother's day at 8 in the morning) there was a very small selection of bread to buy.  I really wanted to like this place, but not coming back again.  I'll stick to Renaud's.",2013-05-15 14:19:17
5DH75mL2XBjkhTIXKOTezg,lYG6ImVXBfDp-3uMzX8tMQ,O6RCCmz8-x4NhWJpI8KQug,3,0,0,0,"Happy to check out a new spot to have morning coffee and work. Latte tasted weak and watery. Bagel was served cold. On the bright side - there were lots of places to sit, wifi, and power outlets.",2017-02-13 19:32:41
ekzSH1s_5p-gds0910bSQw,mB9xbY9Xlozjnw1ZTQkYfQ,bjhCtlYHrkgA5Ku8l-rB3g,2,3,0,0,"I ate hummus from here and got diarrhea within a couple of hours. I also started feeling unwell. But the shop itself it pretty fine. I found the prices to be a bit expensive, but maybe that's just downtown Santa Barbara.",2015-06-02 22:40:27
4E9nTP70lHDgg3HqXvIPBA,wXeCTjInUv3krc1y_oIY3Q,bjhCtlYHrkgA5Ku8l-rB3g,3,0,1,0,"Excellent service. LOVED the gentleman at the counter. But, my coffee was burnt and the food was cold. I would return for a scone, or for some of that delicious looking bread... I wouldn't go for breakfast, it was  disappointing and over priced.",2013-12-14 01:33:07
ul7u7ykCS5LO9QBWs2FDjw,ZHHvHrjxK5uHM6Uw9xeCJg,bjhCtlYHrkgA5Ku8l-rB3g,2,0,0,0,"Ugh. My husband and I stopped in here today to order  a couple sandwiches for lunch. It took 30 min to get our food, and he was given the wrong sandwich! Not to mention, each panini cost about $10 and was so not worth it -- I ordered a roast veggie panini with goat cheese, and there was barely any goat cheese on the sandwich, like 1/2 an ounce tops! We will not be going back. Stick to South Coast if you want an amazing sandwich for a good price in a reasonable amount of time!",2013-05-27 22:12:45
1TATQ1sQOu_r5vZTMWnJCw,BnRd1XZwhDM0w-mJB10hAQ,bjhCtlYHrkgA5Ku8l-rB3g,2,1,0,0,"Such a disappointment yet again, my order was a veggie breakfast burrito, and yes I asked for egg whites, I know so annoying, but whatever. That is what I wanted. Veggies were uncooked an excessive amount of onions and uncooked bell peppers, there was also some mixed greens inside of the burrito which I believe they just added  to fill the burrito. It looked as if there was only 1 or two egg whites in there, and lastly for 2 dollar add avocado I got 2 slices. So that was cool. Won't go back unless I need some bread or some fresh oj....",2017-09-26 19:29:57
UbA0E_P30dyuWVp75gDSPA,cvs1QA3VSnhKzHWvCDKRUA,bjhCtlYHrkgA5Ku8l-rB3g,2,0,0,0,"Limited seating. Menu was ok. Not a coffee drinker, so probably why my review is low.",2017-03-13 03:20:00
ciLnMWsbo5Uclva_vAMypw,2dg0AzOM6acnVl3G4PlXiw,bjhCtlYHrkgA5Ku8l-rB3g,2,0,0,0,Fish Tacos were a little over cooked. Our food got to us kind of cold. Cute little corner. The price for the food was not really worth it. The service was great and the employees made me feel welcome.,2016-03-04 21:20:36
SUYilggI290kvZHRW4Hv4Q,kp7rky4EBsHCRkFEO23f6Q,bjhCtlYHrkgA5Ku8l-rB3g,2,0,0,0,Very expensive for what you get. A croissant and a coffee with run you for around $6.50 with tips. Sorry but the croissant was dry and really not tasty. I'm french so i believe i know how  a croissant should taste :) Kind of disappointed about it. The place is great though. The staff is pretty friendly but i will not go back. I'm pretty sure if they don't change the quality and the price they will be gone quickly!,2017-12-15 01:04:32
spFXoInseajkP-kMcmLgsw,AekJJM_FaiTL3u5U0RStww,O6RCCmz8-x4NhWJpI8KQug,3,2,0,0,"I was so excited to try this place because Instagram made it look real hip, but unfortunately it was a disappointment. My macchiato, looked cute but tasted average. There was too much milk, so the espresso to milk ratio was off. And it was lukewarm. The space itself is great, and I like how they have different options for food. But the coffee itself is nothing special, so I think I'll stick to French press when I'm in SB!",2016-08-08 05:50:27
-o4cSKrQwP1QquaW0UmyLg,gwYE77ZX2fpFdOLeiR_64Q,bjhCtlYHrkgA5Ku8l-rB3g,2,2,0,0,"Vegan muffin, hot coco, oatmeal, coffee, fruit cup and a breakfast burrito cost $35. The oatmeal was nasty, and I love oatmeal. The fruit wasn't ripe and they forgot to give us half our order. Coffee and muffin were tasty but I won't be back. There are to many more deserving places that will provide better quality food and service. Ok for a coffee and muffin stop, but I wouldn't recommend this place for anything else.",2015-11-16 19:02:53
72zACYx5SV3vH2eebY0yFg,0mim_KQY50nHstGOnZcu5A,O6RCCmz8-x4NhWJpI8KQug,1,4,3,0,"Called breakfast...and guess what...no breakfast. Just another coffee spot...in the midst of 8 other places that serve coffee and espresso. Wish they would close. The neighborhood needs a family restraunt...not another place to buy coffee...and stale pasteries...oh they have art.  Who cares...and vegan donuts? if you want a donut, you go to spudnuts. This place is a joke and after reading other similar reviews, you would think the owner would make some quick changes...nope",2016-08-11 19:43:22
6I-YOxHIRnCPaZh3-vf4Rw,BF8D_A_8JbPIh5CKQskRiQ,bjhCtlYHrkgA5Ku8l-rB3g,1,2,0,0,"Staying across the street from this place and was excited to c a mom n pop bakery their.Well it only lasted til I bit my muffin.The person at the counter kept saying that the products were all freshly baked """"COME ON MAN"" who are u trying to convince.Youre telling me that all of the items were baked fresh that morning in that small space LMAO.Ahhhh  ok.Returned my money and we walked away.SUPER DISAPPOINTED THAT YOU CAN SIT THEIR AND CLAIM THE FRESHNESS OF THESE PRODUCTS.Shame on you!!!",2017-08-15 16:01:27
Jrfz4_7nmloFkx7bL9Y1DA,XH9YHRA0RemnmXwhRJ-eow,O6RCCmz8-x4NhWJpI8KQug,2,2,3,0,"every time I come here they seem to be ""out"" of what I initially want to order. settled for a plain cup of coffee this morning and it was too sour for me to finish",2017-08-07 18:03:36
49TE5Uf6jbxMLni_yp_rYQ,ArCmLSEqQwTC1wqCMoaV9w,bjhCtlYHrkgA5Ku8l-rB3g,2,1,1,0,You can do better. Nice enough place with average coffee. Good morning pastry options. Gluten free options. Playing bad techno at 7AM - ugh.,2015-02-28 15:46:55
gHnMw8fwZsbkBk6K3xvolg,nCNQBzWgZ6aRdqcTmJ6Txg,O6RCCmz8-x4NhWJpI8KQug,3,4,2,1,"Yep, the space is amazing with wifi and outdoor seating and lots of natural light, but go here knowing there isn't any breakfast and that it's $7 for a coffee and a scone.",2016-07-19 01:50:47
2pk2VEQkmlbYa3oi3IhH8Q,dpMsaD5YNHX_lUQbQdqEuQ,bjhCtlYHrkgA5Ku8l-rB3g,1,0,0,0,"Stopped in for a quick breakfast while the GF was at a medical appointment.  Placed my order for scrambled eggs, French toast and sausage, took a number for the table.  Twenty minutes later I was out of things to read and getting edgy about the time.  Then my order showed up; eggs were fine, but the French toast wasn't French, just toast!  The two tiny sausages were totally bland, tasteless.  Coffee was OK, though.  Went to the register to pay, found that I hadn't been given a check, requiring a staff meeting.  Finally got to pay what I consider to be an exorbitant price for a miserable meal.  Warning all my SB friends about this place!",2015-12-17 18:25:54
